,title,price,rating,availability
376,Murder at the 42nd Street Library (Raymond Ambler #1),£54.36,Four,In stock
377,Most Wanted,£35.28,Three,In stock
378,"Love, Lies and Spies",£20.55,Two,In stock
379,How to Speak Golf: An Illustrated Guide to Links Lingo,£58.32,Five,In stock
380,Hide Away (Eve Duncan #20),£11.84,One,In stock
381,Furiously Happy: A Funny Book About Horrible Things,£41.46,Four,In stock
382,Everyday Italian: 125 Simple and Delicious Recipes,£20.10,Five,In stock
383,Equal Is Unfair: America's Misguided Fight Against Income Inequality,£56.86,One,In stock
384,Eleanor & Park,£56.51,Five,In stock
385,Dirty (Dive Bar #1),£40.83,Four,In stock
386,Can You Keep a Secret? (Fear Street Relaunch #4),£48.64,One,In stock
387,Boar Island (Anna Pigeon #19),£59.48,Three,In stock
388,A Paris Apartment,£39.01,Four,In stock
389,"A la Mode: 120 Recipes in 60 Pairings: Pies, Tarts, Cakes, Crisps, and More Topped with Ice Cream, Gelato, Frozen Custard, and More",£38.77,One,In stock
390,Troublemaker: Surviving Hollywood and Scientology,£48.39,Two,In stock
391,The Widow,£27.26,Two,In stock
392,"The Sleep Revolution: Transforming Your Life, One Night at a Time",£11.68,Four,In stock
393,The Improbability of Love,£59.45,One,In stock
394,The Art of Startup Fundraising,£21.00,Three,In stock
395,Take Me Home Tonight (Rock Star Romance #3),£53.98,Three,In stock
396,Sleeping Giants (Themis Files #1),£48.74,One,In stock
397,"Setting the World on Fire: The Brief, Astonishing Life of St. Catherine of Siena",£21.15,Two,In stock
398,Playing with Fire,£13.71,Three,In stock
399,Off the Hook (Fishing for Trouble #1),£47.67,Three,In stock
